{
  "$schema": "http://json-schema.org/draft-07/schema#",
  "type": "object",
  "properties": {
    "title": {
      "type": "string"
    },
    "sessionId": {
      "type": "string"
    },
    "workspaceDirectory": {
      "type": "string"
    },
    "history": {
      "type": "array",
      "items": {
        "type": "object",
        "properties": {
          "message": {
            "type": "object",
            "properties": {
              "role": {
                "type": "string",
                "enum": ["user", "assistant"]
              },
              "content": {
                "oneOf": [
                  {
                    "type": "string"
                  },
                  {
                    "type": "array",
                    "items": {
                      "type": "object",
                      "properties": {
                        "type": {
                          "type": "string"
                        },
                        "text": {
                          "type": "string"
                        }
                      },
                      "required": ["type", "text"]
                    }
                  }
                ]
              }
            },
            "required": ["role", "content"]
          },
          "contextItems": {
            "type": "array",
            "items": {
              "type": "object"
            }
          },
          "editorState": {
            "type": "object",
            "properties": {
              "type": {
                "type": "string"
              },
              "content": {
                "type": "array",
                "items": {
                  "type": "object",
                  "properties": {
                    "type": {
                      "type": "string"
                    },
                    "content": {
                      "type": "array",
                      "items": {
                        "type": "object",
                        "properties": {
                          "type": {
                            "type": "string"
                          },
                          "text": {
                            "type": "string"
                          }
                        },
                        "required": ["type", "text"]
                      }
                    }
                  },
                  "required": ["type", "content"]
                }
              }
            },
            "required": ["type", "content"]
          },
          "promptLogs": {
            "type": "array",
            "items": {
              "type": "object",
              "properties": {
                "modelTitle": {
                  "type": "string"
                },
                "prompt": {
                  "type": "string"
                },
                "completion": {
                  "type": "string"
                },
                "completionOptions": {
                  "type": "object",
                  "properties": {
                    "model": {
                      "type": "string"
                    },
                    "maxTokens": {
                      "type": "integer"
                    }
                  },
                  "required": ["model", "maxTokens"]
                }
              },
              "required": ["modelTitle", "prompt", "completion", "completionOptions"]
            }
          }
        },
        "required": ["message", "contextItems"]
      }
    }
  },
  "required": ["title", "sessionId", "workspaceDirectory", "history"]
}
