{
  "title": "How do multiple redis connections work with red...",
  "sessionId": "9dc60991-8893-4241-95cf-da3780f3886a",
  "workspaceDirectory": "/Users/d/Projects/opensource/onetime/onetimesecret",

  "history": [
    {
      "message": {
        "role": "user",
        "content": [
          {
            "type": "text",
            "text": "How do multiple redis connections work with redis-rb"
          }
        ]
      },
      "contextItems": [],
      "editorState": {
        "type": "doc",
        "content": [
          {
            "type": "paragraph",
            "content": [
              {
                "type": "text",
                "text": "How do multiple redis connections work with redis-rb"
              }
            ]
          }
        ]
      }
    },
    {
      "message": {
        "role": "assistant",
        "content": "When working with multiple Redis connections using the redis-rb gem in Ruby, you have a few options:\n\n1. Separate Redis client instances:\n\nYou can create multiple Redis client instances, each connecting to a different Redis server or database:\n\n```ruby\nrequire 'redis'\n\nredis1 = Redis.new(host: \"localhost\", port: 6379, db: 0)\nredis2 = Redis.new(host: \"localhost\", port: 6379, db: 1)\n\nredis1.set(\"key1\", \"value1\")\nredis2.set(\"key2\", \"value2\")\n```\n\n2. Connection pools:\n\nFor better performance and connection management, you can use connection pools:\n\n```ruby\nrequire 'redis'\nrequire 'connection_pool'\n\nREDIS_POOL = ConnectionPool.new(size: 5, timeout: 5) do\n  Redis.new(host: \"localhost\", port: 6379)\nend\n\nREDIS_POOL.with do |redis|\n  redis.set(\"key\", \"value\")\nend\n```\n\n3. Redis::Distributed:\n\nFor distributing data across multiple Redis servers:\n\n```ruby\nrequire 'redis/distributed'\n\nredis = Redis::Distributed.new([\n  \"redis://localhost:6379/0\",\n  \"redis://localhost:6380/0\",\n  \"redis://localhost:6381/0\"\n])\n\nredis.set(\"key\", \"value\")\n```\n\n4. Redis Sentinel:\n\nFor high availability setups:\n\n```ruby\nrequire 'redis'\n\nredis = Redis.new(url: \"redis://mymaster/0\")\n```\n\n5. Redis Cluster:\n\nFor sharding data across multiple nodes:\n\n```ruby\nrequire 'redis'\n\nredis = Redis.new(cluster: [\"redis://127.0.0.1:7000\", \"redis://127.0.0.1:7001\"])\n```\n\nKey points to remember:\n\n1. Each connection is independent and maintains its own state.\n2. Use connection pools for better performance in multi-threaded environments.\n3. Choose the appropriate method based on your specific use case (e.g., sharding, high availability, etc.).\n4. Be mindful of connection limits and resource usage, especially in production environments.\n5. Always handle exceptions and implement proper error handling for Redis operations."
      },
      "contextItems": [],
      "promptLogs": [
        {
          "modelTitle": "Claude 3.5 Sonnet",
          "prompt": "<user>\nHow do multiple redis connections work with redis-rb\n\n",
          "completion": "When working with multiple Redis connections using the redis-rb gem in Ruby, you have a few options:\n\n1. Separate Redis client instances:\n\nYou can create multiple Redis client instances, each connecting to a different Redis server or database:\n\n```ruby\nrequire 'redis'\n\nredis1 = Redis.new(host: \"localhost\", port: 6379, db: 0)\nredis2 = Redis.new(host: \"localhost\", port: 6379, db: 1)\n\nredis1.set(\"key1\", \"value1\")\nredis2.set(\"key2\", \"value2\")\n```\n\n2. Connection pools:\n\nFor better performance and connection management, you can use connection pools:\n\n```ruby\nrequire 'redis'\nrequire 'connection_pool'\n\nREDIS_POOL = ConnectionPool.new(size: 5, timeout: 5) do\n  Redis.new(host: \"localhost\", port: 6379)\nend\n\nREDIS_POOL.with do |redis|\n  redis.set(\"key\", \"value\")\nend\n```\n\n3. Redis::Distributed:\n\nFor distributing data across multiple Redis servers:\n\n```ruby\nrequire 'redis/distributed'\n\nredis = Redis::Distributed.new([\n  \"redis://localhost:6379/0\",\n  \"redis://localhost:6380/0\",\n  \"redis://localhost:6381/0\"\n])\n\nredis.set(\"key\", \"value\")\n```\n\n4. Redis Sentinel:\n\nFor high availability setups:\n\n```ruby\nrequire 'redis'\n\nredis = Redis.new(url: \"redis://mymaster/0\")\n```\n\n5. Redis Cluster:\n\nFor sharding data across multiple nodes:\n\n```ruby\nrequire 'redis'\n\nredis = Redis.new(cluster: [\"redis://127.0.0.1:7000\", \"redis://127.0.0.1:7001\"])\n```\n\nKey points to remember:\n\n1. Each connection is independent and maintains its own state.\n2. Use connection pools for better performance in multi-threaded environments.\n3. Choose the appropriate method based on your specific use case (e.g., sharding, high availability, etc.).\n4. Be mindful of connection limits and resource usage, especially in production environments.\n5. Always handle exceptions and implement proper error handling for Redis operations.",
          "completionOptions": {
            "model": "claude-3-5-sonnet-20240620",
            "maxTokens": 4096
          }
        }
      ]
    },
    {
      "message": {
        "role": "user",
        "content": [
          {
            "type": "text",
            "text": "Which options are apprpriate for using thin or unicorn or falcon web servers"
          }
        ]
      },
      "contextItems": [],
      "editorState": {
        "type": "doc",
        "content": [
          {
            "type": "paragraph",
            "content": [
              {
                "type": "text",
                "text": "Which options are apprpriate for using thin or unicorn or falcon web servers"
              }
            ]
          }
        ]
      }
    },
    {
      "message": {
        "role": "assistant",
        "content": "When using thin, unicorn, or falcon web servers with Redis, the most appropriate options are typically:\n\n1. Separate Redis client instances\n2. Connection pools\n\nLet's discuss why these are suitable and how to implement them:\n\n1. Separate Redis client instances:\n\nThis approach is simple and can work well, especially if you're not dealing with a high volume of concurrent requests. Each worker process can have its own Redis connection.\n\n```ruby\nrequire 'redis'\n\nredis = Redis.new(host: \"localhost\", port: 6379)\n\n# In your application code\nget '/some_route' do\n  value = redis.get(\"some_key\")\n  # ... rest of your logic\nend\n```\n\n2. Connection pools:\n\nThis is generally the recommended approach, especially for unicorn and falcon, which can handle concurrent requests. Connection pools help manage Redis connections efficiently, preventing issues like connection exhaustion.\n\n```ruby\nrequire 'redis'\nrequire 'connection_pool'\n\nREDIS_POOL = ConnectionPool.new(size: 5, timeout: 5) do\n  Redis.new(host: \"localhost\", port: 6379)\nend\n\n# In your application code\nget '/some_route' do\n  REDIS_POOL.with do |redis|\n    value = redis.get(\"some_key\")\n    # ... rest of your logic\n  end\nend\n```\n\nFor each server:\n\n1. Thin:\n   Thin is single-threaded but event-driven. You can use either separate instances or a connection pool. A connection pool might be overkill for a single-threaded server, but it can still help manage connections efficiently.\n\n2. Unicorn:\n   Unicorn uses multiple worker processes. Each worker should have its own Redis connection or, preferably, its own connection pool. This is because Unicorn forks worker processes, and Redis connections cannot be shared across forks.\n\n   In your unicorn.rb configuration:\n\n   ```ruby\n   after_fork do |server, worker|\n     REDIS_POOL.reload if defined?(REDIS_POOL)\n   end\n   ```\n\n3. Falcon:\n   Falcon is multi-threaded and can handle concurrent requests. A connection pool is highly recommended here to efficiently manage Redis connections across threads.\n\nGeneral tips:\n\n1. Adjust the pool size based on your application's needs and the number of worker processes/threads.\n2. Always handle exceptions and implement proper error handling for Redis operations.\n3. Monitor your Redis connections and adjust as necessary.\n4. If you're using an ORM or other gems that interact with Redis, ensure they're configured to use the connection pool if available.\n\nRemember, the exact implementation might vary depending on your specific application structure and requirements. The key is to ensure that Redis connections are managed efficiently and don't become a bottleneck in your application."
      },
      "contextItems": [],
      "promptLogs": [
        {
          "modelTitle": "Claude 3.5 Sonnet",